{
    "title": "Another amazing proposal",
    "summary": "You won't even believe it",
    "tokensRequested": "300000000000000000000000",
    "firstName": "Sarah",
    "lastName": "Ethers",
    "email": "sarah@eth.io",
    "github": "sethers",
    "website": "se.io",
    "projectPlan": "2019 is gonna be good",
    "projectTimeline": "2020 is gonna be great",
    "teamBackgrounds": "I do this. He does that.",
    "totalBudget": "$2,000,000 for this. $100,000 for that.",
    "otherFunding": "n/a",
    "awardAddress": "0xD09cc3Bc67E4294c4A446d8e4a2934a921410eD7"
}
